{
  "kind": "build_update",
  "iteration": 1,
  "milestone_id": "M1",
  "summary": "Initialized run directory structure and wrote initial state.json schema.",
  "changes_made": [
    "Created runs/<run_id>/state.json initializer",
    "Added artifact folders and naming convention"
  ],
  "files_touched": [
    "conductor.py",
    "conductor/state_machine.md"
  ],
  "next_actions": [
    "Run smoke tests",
    "Proceed to M2 proposal fan-out after green"
  ],
  "self_reported_risks": [
    "Need to ensure denylist globs cover OS keychains on macOS."
  ],
  "notes_for_reviewer": "Focus on whether state transitions cover all stop conditions."
}
